{
  "$schema": "https://status.dig.net/health.schema.json",
  "schemaVersion": 1,
  "overall": "down",
  "generatedAt": "2026-10-18T11:02:00.292Z",
  "systems": {
    "rpc": "up",
    "hub-api": "down",
    "docs": "up",
    "explore": "up",
    "dignet": "up",
    "cdn": "degraded",
    "apt": "up",
    "on-resolver": "down",
    "bugreport-api": "down",
    "relay": "up",
    "coinset": "up",
    "chia-mainnet": "up"
  }
}
